{
  "schemaVersion": "1.0.0",
  "artifactType": "discussion-session",
  "fixture": true,
  "source": "synthetic-test-fixture",
  "sessionId": "demo-persistence-boundary",
  "title": "Should the built-in demo write to Firebase?",
  "topic": "Built-in Demo persistence boundary",
  "objective": "Demonstrate the fixed-round protocol using the accepted local-only Demo boundary.",
  "status": "completed",
  "executionMode": "import-only",
  "context": {
    "knownFacts": ["The built-in Demo is local-only and read-only.", "The Demo is not added to myTrips.", "These contributions are synthetic and were not produced by external Agents."],
    "repositoryPaths": ["src/features/onboarding/demoTripData.js", "src/features/onboarding/DemoTripPreview.jsx", ".ai/DECISIONS.md"],
    "decisions": ["Demo does not write Firebase.", "Demo does not join myTrips."]
  },
  "constraints": ["Do not modify product code.", "Do not access Firebase.", "Do not treat fixture responses as real Agent records."],
  "questions": ["Should the built-in Demo write to Firebase?", "Which boundaries prove that behavior?", "Which regression checks preserve it?"],
  "participants": [
    { "participantId": "codex-engineer", "agent": "codex", "role": "engineer", "required": true, "writeAccess": false, "availability": "available" },
    { "participantId": "gemini-analyst", "agent": "gemini", "role": "analyst", "required": true, "writeAccess": false, "availability": "unavailable" },
    { "participantId": "reviewer", "agent": "human", "role": "reviewer", "required": true, "writeAccess": false, "availability": "human-controlled" },
    { "participantId": "architect", "agent": "codex", "role": "architect", "required": false, "writeAccess": false, "availability": "available" },
    { "participantId": "qa-owner", "agent": "human", "role": "qa", "required": false, "writeAccess": false, "availability": "human-controlled" },
    { "participantId": "human-approver", "agent": "human", "role": "approver", "required": false, "writeAccess": false, "availability": "human-controlled" }
  ],
  "rounds": {
    "round1ContributionIds": ["r1-codex-analysis", "r1-gemini-analysis", "r1-reviewer-analysis"],
    "round2ContributionIds": ["r2-codex-critique", "r2-gemini-critique", "r2-reviewer-critique"]
  },
  "decision": { "decisionId": "demo-no-firebase", "proposalPath": "decision/proposal.json" },
  "humanApproval": { "required": true, "approverParticipantId": "human-approver", "approvalPath": "decision/human-approval.json" },
  "assignments": ["assignments/docs-assignment.json", "assignments/qa-assignment.json"],
  "timestamps": { "createdAt": "2026-07-22T08:00:00Z", "updatedAt": "2026-07-22T08:30:00Z" }
}
